disease,description
malaria,"Malaria has had a greater impact on world history than any other infectious disease. More than 300 to 500 million individuals worldwide are infected with Plasmodium spp, and 1.5 to 2.7 million people a year, most of whom are children, die from the infection. Malaria is endemic in over 90 countries in which 2400 million people live; this represents 40% of the world's population. Approximately 90% of malaria deaths occur in Africa. Despite continuing efforts in vaccine development, malaria prevention is difficult, and no drug is universally effective. This article examines malaria caused by the 4 most common Plasmodium spp that infect humans, P vivax, P ovale, P malariae, and P falciparum, as well as mixed infections and the simian parasite P knowlesi. A comprehensive review of the microbiology, clinical presentation, pathogenesis, diagnosis, and treatment of these forms of malaria is given...."
malignant otitis externa,"Malignant otitis externa is a progressive infection of the external auditory canal and skull base. Pseudomonas aeruginosa is the most isolated microorganism and it affects mostly to diabetic, elderly, and immunocompromised individuals. Non-resolving otalgia and chronic otorrhea are the clinical manifestations presented. Facial nerve palsy is a common and well recognized complication. (Computed tomography) CT scan is useful for initial assessment, Technetium-99m is highly sensitive and is part of the protocol for diagnosis. Treatment should be individualized, with multidisciplinary cooperation among specialties. Management involves systemic antipseudomonal antibiotics and monitoring with radiologic techniques, it also involves the strict control of diabetes. It is essential to follow up the patients for at least a year post-treatment. In refractory malignant otitis externa and affection of facial nerve, surgical management is recommended. We reviewed the most recent studies on epidemiology, clinical manifestations, diagnosis, and treatment to provide an update on Malignant Otitis Externa that can offer an overview for clinical practice and future research...."
mediastinitis,"Acute mediastinitis is a rare infection that carries high morbidity and mortality. They are complications seen most often with deep sternal wound infections from surgeries with median sternotomies, oropharyngeal and odontogenic infections and esophageal perforations. These conditions should be promptly recognized and treated. Mediastinal granulomas are focal, mass-like lesions commonly resulting from prior granulomatous infections. They are regarded as benign, self-resolving lesions however can cause complications by compression of adjacent mediastinal structures. Chronic fibrosing mediastinitis is a rare, diffuse fibroinflammatory process most often seen with granulomatous infections and carries a worse prognosis than mediastinal granulomas especially when adjacent mediastinal structures are compromised. In this review, we discuss the epidemiology, etiology, clinical presentation, treatment and prognosis of acute mediastinitis, mediastinal granulomas, and chronic fibrosing mediastinitis...."
meningitis,"Meningitis is defined as inflammation of the meninges, in almost all cases identified by an abnormal number of white blood cells in the cerebrospinal fluid and specific clinical signs/symptoms. Onset may be acute or chronic, and clinical symptoms of acute disease develop over hours to days. This article reviews the epidemiology, pathophysiology, clinical manifestations, diagnosis, and management of acute meningitis, and provides a list of key points for primary care practitioners. Aseptic and bacterial meningitis vary significantly and are discussed separately...."
migraine,Migraine continues second among the world's causes of disability. Diagnosis is based on the history and clinical examination and imaging is usually not necessary. Migraine can be subdivided depending on whether there is an aura or not and based on the frequency of the headaches. The number of headache days determines whether the patient has episodic migraine or chronic migraine. Treating migraines can be done to treatment the migraine itself and to prevent its appearance. In this review we approach the migraine from a practical point of view with updated information....
mononucleosis,"Infectious mononucleosis is a viral syndrome characterized by fever, pharyngitis, and posterior cervical lymphadenopathy. It is usually caused by Epstein-Barr virus and most often affects adolescents and young adults 15 to 24 years of age. Primary transmission is through close personal contact with a person who is infected, particularly their saliva. Cost-effective, efficient initial laboratory testing for acute infectious mononucleosis includes complete blood count with differential (to assess for greater than 40% lymphocytes and greater than 10% atypical lymphocytes) and a rapid heterophile antibody test. The heterophile antibody test has a sensitivity of 87% and specificity of 91% but can have a false-negative result in children younger than five years and in adults during the first week of illness. The presence of elevated liver enzymes increases clinical suspicion for infectious mononucleosis in the setting of a negative heterophile antibody test result. Epstein-Barr viral capsid antigen-antibody testing is more sensitive and specific but more expensive and takes longer to process than the rapid heterophile antibody test. Treatment of infectious mononucleosis is supportive; routine use of antivirals and corticosteroids is not recommended. Current guidelines recommend that patients with infectious mononucleosis not participate in athletic activity for three weeks from onset of symptoms. Shared decision-making should be used to determine the timing of return to activity. Immunosuppressed populations are at higher risk of severe disease and significant morbidity. Epstein-Barr virus infection has been linked to nine types of cancer, including Hodgkin lymphoma, non-Hodgkin lymphoma, and nasopharyngeal carcinoma, and some autoimmune diseases...."
mumps,"Mumps is an important childhood infectious disease caused by mumps virus (MuV). We reviewed the epidemiology, pathogenesis, and vaccine development of mumps. Previous studies were identified using the key words ""mumps"" and ""epidemiology"", ""pathogenesis"" or ""vaccine"" in MEDLINE, PubMed, Embase, Web of Science, and Google Scholar. We excluded the articles that were not published in the English language, manuscripts without abstracts, and opinion articles from the review. The number of cases caused by MuV decreased steeply after the introduction of the mumps vaccine worldwide. In recent years, a global resurgence of mumps cases in developed countries and cases of aseptic meningitis caused by some mumps vaccine strains have renewed the importance of MuV infection worldwide. The performance of mumps vaccination has become an important issue for controlling mumps infections. Vaccine development and routine vaccination are still effective measures to globally reduce the incidence of mumps infections. During outbreaks, a third of MMR vaccine is recommended for groups of persons determined by public authorities...."
myocarditis,"Myocarditis may present with a wide range of symptoms, ranging from mild dyspnea or chest pain that resolves without specific therapy to cardiogenic shock and death. Dilated cardiomyopathy with chronic heart failure is the major long-term sequela of myocarditis. Most often, myocarditis results from common viral infections; less commonly, specific forms of myocarditis may result from other pathogens, toxic or hypersensitivity drug reactions, giant-cell myocarditis, or sarcoidosis. The prognosis and treatment of myocarditis vary according to the cause, and clinical and hemodynamic data usually provide guidance to decide when to refer a patient to a specialist for endomyocardial biopsy. The aim of this review is to provide a practical and current approach to the evaluation and treatment of suspected myocarditis...."
nasal polyp,"Chronic rhinosinusitis with nasal polyps (CRSwNP) is an important clinical entity diagnosed by the presence of both subjective and objective evidence of chronic sinonasal inflammation. Symptoms include anterior or posterior rhinorrhea, nasal congestion, hyposmia, and/or facial pressure or pain that last for a duration of more than 12 weeks. Nasal polyps are inflammatory lesions that project into the nasal airway, are typically bilateral, and originate from the ethmoid sinus. Males are more likely to be affected than females, but no specific genetic or environmental factors have been strongly linked to the development of this disorder to date. CRSwNP is frequently associated with asthma and allergic rhinitis, but the cellular and molecular mechanisms that contribute to the clinical symptoms are not fully understood. Defects in the sinonasal epithelial cell barrier, increased exposure to pathogenic and colonized bacteria, and dysregulation of the host immune system are all thought to play prominent roles in disease pathogenesis. Additional studies are needed to further explore the clinical and pathophysiological features of CRSwNP so that biomarkers can be identified and novel advances can be made to improve the treatment and management of this disease...."
neuralgia,"Neuropathic pain caused by a lesion or disease of the somatosensory nervous system is a common chronic pain condition with major impact on quality of life. Examples include trigeminal neuralgia, painful polyneuropathy, postherpetic neuralgia, and central poststroke pain. Most patients complain of an ongoing or intermittent spontaneous pain of, for example, burning, pricking, squeezing quality, which may be accompanied by evoked pain, particular to light touch and cold. Ectopic activity in, for example, nerve-end neuroma, compressed nerves or nerve roots, dorsal root ganglia, and the thalamus may in different conditions underlie the spontaneous pain. Evoked pain may spread to neighboring areas, and the underlying pathophysiology involves peripheral and central sensitization. Maladaptive structural changes and a number of cell-cell interactions and molecular signaling underlie the sensitization of nociceptive pathways. These include alteration in ion channels, activation of immune cells, glial-derived mediators, and epigenetic regulation. The major classes of therapeutics include drugs acting on α2δ subunits of calcium channels, sodium channels, and descending modulatory inhibitory pathways...."
noninfectious gastroenteritis,"Probiotics have been considered as an economical and safe alternative for the treatment of a large number of chronic diseases and improvement of human health. They are known to modulate the host immunity and protect from several infectious and non-infectious diseases. The colonization, killing of pathogens and induction of host cells are few of the important probiotic attributes which affect several functions of the host. In addition, prebiotics and non-digestible food substances selectively promote the growth of probiotics and human health through nutrient enrichment, and modulation of gut microbiota and immune system. This review highlights the role of probiotics and prebiotics alone and in combination (synbiotics) in the modulation of immune system, treatment of infections, management of inflammatory bowel disease and cancer therapy. KEY POINTS: • Probiotics and their derivatives against several human diseases. • Prebiotics feed probiotics and induce several functions in the host. • Discovery of novel and biosafe products needs attention for human health...."
nose disorder,"Nasal disease in dogs is common and is often accompanied by chronic nasal discharge with or without other clinical signs. A thorough history and physical examination often guide the most appropriate choice of diagnostic testing to provide the best chance of attaining a diagnosis as to cause, and therefore, the most appropriate treatment. The purpose of this article is to guide the practitioner through a logical approach to the evaluation of dogs that are presented with signs of nasal disease...."
obsessive compulsive disorder (ocd),"Obsessive-compulsive disorder (OCD) is characterized by time-consuming, distressing, or impairing obsessions and compulsions. Obsessions are recurrent, persistent, and intrusive thoughts, urges, or images. Compulsions are repetitive and often ritualized behaviors or mental acts performed to manage obsession-related distress or prevent harm. OCD affects 1% to 3% of the population, typically begins during adolescence or early adulthood, and can have a chronic or deteriorating course in the absence of effective treatment...."
onychomycosis,"Onychomycosis is a fungal infection of the nail, causing discoloration and thickening of the affected nail plate, and is the most common nail infection worldwide. Onychomycosis was initially thought to be predominantly caused by dermatophytes; however, new research has revealed that mixed infections and those caused by non-dermatophyte moulds (NDMs) are more prevalent than previously thought, especially in warmer climates. Microscopy and fungal culture are the gold standard techniques for onychomycosis diagnosis, but high false-negative rates have pushed for more accurate methods, such as histology and PCR. As NDMs are skin and laboratory contaminants, their presence as an infectious agent requires multiple confirmations and repeated sampling. There are several treatment options available, including oral antifungals, topicals and devices. Oral antifungals have higher cure rates and shorter treatment periods than topical treatments, but have adverse side effects such as hepatotoxicity and drug interactions. Terbinafine, itraconazole and fluconazole are most commonly used, with new oral antifungals such as fosravuconazole being evaluated. Topical treatments, such as efinaconazole, tavaborole, ciclopirox and amorolfine have less serious side effects, but also have generally lower cure rates and much longer treatment regimens. New topical formulations are being investigated as faster-acting alternatives to the currently available topical treatments. Devices such as lasers have shown promise in improving the cosmetic appearance of the nail, but due to a high variation of study methods and definitions of cure, their effectiveness for onychomycosis has yet to be sufficiently proven. Recurrence rates for onychomycosis are high; once infected, patients should seek medical treatment as soon as possible and sanitize their shoes and socks. Prophylactic application of topicals and avoiding walking barefoot in public places may help prevent recurrence...."
open wound due to trauma,"Wound healing is a complex, dynamic process supported by a myriad of cellular events that must be tightly coordinated to efficiently repair damaged tissue. Derangement in wound-linked cellular behaviours, as occurs with diabetes and ageing, can lead to healing impairment and the formation of chronic, non-healing wounds. These wounds are a significant socioeconomic burden due to their high prevalence and recurrence. Thus, there is an urgent requirement for the improved biological and clinical understanding of the mechanisms that underpin wound repair. Here, we review the cellular basis of tissue repair and discuss how current and emerging understanding of wound pathology could inform future development of efficacious wound therapies...."
open wound of the arm,"Cervical spinal cord injury (SCI) leads to permanent impairment of arm and hand functions. Here we conducted a prospective, single-arm, multicenter, open-label, non-significant risk trial that evaluated the safety and efficacy of ARCEX Therapy to improve arm and hand functions in people with chronic SCI. ARCEX Therapy involves the delivery of externally applied electrical stimulation over the cervical spinal cord during structured rehabilitation. The primary endpoints were safety and efficacy as measured by whether the majority of participants exhibited significant improvement in both strength and functional performance in response to ARCEX Therapy compared to the end of an equivalent period of rehabilitation alone. Sixty participants completed the protocol. No serious adverse events related to ARCEX Therapy were reported, and the primary effectiveness endpoint was met. Seventy-two percent of participants demonstrated improvements greater than the minimally important difference criteria for both strength and functional domains. Secondary endpoint analysis revealed significant improvements in fingertip pinch force, hand prehension and strength, upper extremity motor and sensory abilities and self-reported increases in quality of life. These results demonstrate the safety and efficacy of ARCEX Therapy to improve hand and arm functions in people living with cervical SCI. ClinicalTrials.gov identifier: NCT04697472 ...."
optic neuritis,"This article discusses the clinical presentation, evaluation, and management of the patient with optic neuritis. Initial emphasis is placed on clinical history, examination, diagnostic testing, and medical decision making, while subsequent focus is placed on examining specific inflammatory optic neuropathies. Clinical clues, examination findings, neuroimaging, and laboratory testing that differentiate autoimmune, granulomatous, demyelinating, infectious, and paraneoplastic causes of optic neuritis are assessed, and current treatments are evaluated...."
oral mucosal lesion,"Oral cancer (OC) is an uncommon malignancy in Western countries, being one of the most common cancers in some high-risk areas of the world. It is a largely preventable cancer, since most of the different risk factors identified, such as tobacco use, alcohol consumption, and betel nut chewing, are behaviors that increase the likelihood of the disease. Given its high mortality, early diagnosis is of utmost importance. Prevention and the anticipation of diagnosis begin with identification of potentially malignant lesions of the oral mucosa and with local conditions promoting chronic inflammation. Therefore, every lesion must be recognized promptly and treated adequately. The clinical recognition and evaluation of oral mucosal lesions can detect up to 99% of oral cancers/premalignancies. As stated by the World Health Organization, any suspicious lesion that does not subside within two weeks from detection and removal of local causes of irritation must be biopsied. Surgical biopsy remains the gold standard for diagnosis of oral cancer. Adjunctive tools have been developed and studied to help clinicians in the diagnostic pathway, such as toluidine blue vital staining and autofluorescence imaging. In the near future other methods, i.e., identification of salivary markers of progression may help in reducing mortality due to oral cancer...."
osteomyelitis,"Bone and joint infections are painful for patients and frustrating for both them and their doctors. The high success rates of antimicrobial therapy in most infectious diseases have not yet been achieved in bone and joint infections owing to the physiological and anatomical characteristics of bone. The key to successful management is early diagnosis, including bone sampling for microbiological and pathological examination to allow targeted and long-lasting antimicrobial therapy. The various types of osteomyelitis require differing medical and surgical therapeutic strategies. These types include, in order of decreasing frequency: osteomyelitis secondary to a contiguous focus of infection (after trauma, surgery, or insertion of a joint prosthesis); that secondary to vascular insufficiency (in diabetic foot infections); or that of haematogenous origin. Chronic osteomyelitis is associated with avascular necrosis of bone and formation of sequestrum (dead bone), and surgical debridement is necessary for cure in addition to antibiotic therapy. By contrast, acute osteomyelitis can respond to antibiotics alone. Generally, a multidisciplinary approach is required for success, involving expertise in orthopaedic surgery, infectious diseases, and plastic surgery, as well as vascular surgery, particularly for complex cases with soft-tissue loss...."
overflow incontinence,"Low back pain is usually nonspecific or mechanical. Mechanical low back pain arises intrinsically from the spine, intervertebral disks, or surrounding soft tissues. Clinical clues, or red flags, may help identify cases of nonmechanical low back pain and prompt further evaluation or imaging. Red flags include progressive motor or sensory loss, new urinary retention or overflow incontinence, history of cancer, recent invasive spinal procedure, and significant trauma relative to age. Imaging on initial presentation should be reserved for when there is suspicion for cauda equina syndrome, malignancy, fracture, or infection. Plain radiography of the lumbar spine is appropriate to assess for fracture and bony abnormality, whereas magnetic resonance imaging is better for identifying the source of neurologic or soft tissue abnormalities. There are multiple treatment modalities for mechanical low back pain, but strong evidence of benefit is often lacking. Moderate evidence supports the use of nonsteroidal anti-inflammatory drugs, opioids, and topiramate in the short-term treatment of mechanical low back pain. There is little or no evidence of benefit for acetaminophen, antidepressants (except duloxetine), skeletal muscle relaxants, lidocaine patches, and transcutaneous electrical nerve stimulation in the treatment of chronic low back pain. There is strong evidence for short-term effectiveness and moderate-quality evidence for long-term effectiveness of yoga in the treatment of chronic low back pain. Various spinal manipulative techniques (osteopathic manipulative treatment, spinal manipulative therapy) have shown mixed benefits in the acute and chronic setting. Physical therapy modalities such as the McKenzie method may decrease the recurrence of low back pain and health care expenditures. Physical therapy modalities such as the McKenzie method may decrease the recurrence of low back pain and use of health care. Educating patients on prognosis and incorporating psychosocial components of care such as identifying comorbid psychological problems and barriers to treatment are essential components of long-term management...."
paronychia,"Paronychia is inflammation of the fingers or toes in one or more of the three nail folds. Acute paronychia is caused by polymicrobial infections after the protective nail barrier has been breached. Treatment consists of warm soaks with or without Burow solution or 1% acetic acid. Topical antibiotics should be used with or without topical steroids when simple soaks do not relieve the inflammation. The presence of an abscess should be determined, which mandates drainage. There are a variety of options for drainage, ranging from instrumentation with a hypodermic needle to a wide incision with a scalpel. Oral antibiotics are usually not needed if adequate drainage is achieved unless the patient is immunocompromised or a severe infection is present. Therapy is based on the most likely pathogens and local resistance patterns. Chronic paronychia is characterized by symptoms of at least six weeks' duration and represents an irritant dermatitis to the breached nail barrier. Common irritants include acids, alkalis, and other chemicals used by housekeepers, dishwashers, bartenders, florists, bakers, and swimmers. Treatment is aimed at stopping the source of irritation while treating the inflammation with topical steroids or calcineurin inhibitors. More aggressive techniques may be required to restore the protective nail barrier. Treatment may take weeks to months. Patient education is paramount to reduce the recurrence of acute and chronic paronychia...."
pelvic inflammatory disease,"Pelvic inflammatory disease (PID) is an infection of the upper genital tract occurring predominantly in sexually active young women. Chlamydia trachomatis and Neisseria gonorrhoeae are common causes; however, other cervical, enteric, bacterial vaginosis-associated, and respiratory pathogens, including Mycobacterium tuberculosis, may be involved. PID can be acute, chronic, or subclinical and is often underdiagnosed. Untreated PID can lead to chronic pelvic pain, infertility, ectopic pregnancy, and intra-abdominal infections. The diagnosis is made primarily on clinical suspicion, and empiric treatment is recommended in sexually active young women or women at risk for sexually transmitted infections who have unexplained lower abdominal or pelvic pain and cervical motion, uterine, or adnexal tenderness on examination. Mild to moderate disease can be treated in an outpatient setting with a single intramuscular injection of a recommended cephalosporin followed by oral doxycycline for 14 days. Additionally, metronidazole is recommended for 14 days in the setting of bacterial vaginosis, trichomoniasis, or recent uterine instrumentation. Hospitalization for parenteral antibiotics is recommended in patients who are pregnant or severely ill, in whom outpatient treatment has failed, those with tubo-ovarian abscess, or if surgical emergencies cannot be excluded. Treatment does not change in patients with intrauterine devices or those with HIV. Sex partner treatment is recommended; expedited partner treatment is recommended where legal. Prevention of PID includes screening for C. trachomatis and N. gonorrhoeae in all women younger than 25 years and those who are at risk or pregnant, plus intensive behavioral counseling for all adolescents and adults at increased risk of sexually transmitted infections...."
