disease,description
glomerulonephritis,"Postinfectious glomerulonephritis (PIGN) is a leading cause of acute glomerulonephritis in children. The presentation of PIGN can vary from asymptomatic microscopic hematuria incidentally detected on routine urinalysis to nephritic syndrome and a rapidly progressive glomerulonephritis. Treatment involves supportive care with salt and water restriction, and the use of diuretic and/or antihypertensive medication, depending on the severity of fluid retention and the presence of hypertension. PIGN resolves completely and spontaneously in most children, and the long-term outcomes are typically good with preserved renal function and no recurrence...."
gout,"Gout is a common and treatable disease caused by the deposition of monosodium urate crystals in articular and non-articular structures. Increased concentration of serum urate (hyperuricaemia) is the most important risk factor for the development of gout. Serum urate is regulated by urate transporters in the kidney and gut, particularly GLUT9 (SLC2A9), URAT1 (SLC22A12), and ABCG2. Activation of the NLRP3 inflammasome by monosodium urate crystals with release of IL-1β plays a major role in the initiation of the gout flare; aggregated neutrophil extracellular traps are important in the resolution phase. Although presenting as an intermittent flaring condition, gout is a chronic disease. Long-term urate lowering therapy (eg, allopurinol) leads to the dissolution of monosodium urate crystals, ultimately resulting in the prevention of gout flares and tophi and in improved quality of life. Strategies such as nurse-led care are effective in delivering high-quality gout care and lead to major improvements in patient outcomes...."
granuloma inguinale,"Donovanosis is a chronic, progressive, and indolent bacterial disease that affects the skin and mucous membranes of the genital and perigenital regions, often associated with sexual transmission, and with low infectivity. The malignant transformation of donovanosis lesions occurs exceptionally, as is usually seen in long-term ulcerations...."
gynecomastia,"Enlargement of breasts among boys is termed gynecomastia. This could be due to an alteration in the androgen-estrogen ratio along with the effects of other hormones including growth hormone, insulin like growth factor 1, prolactin, and other factors affecting aromatase enzyme. The common causes of gynecomastia are pubertal gynecomastia, obesity, drugs and hypogonadism. Several other diseases including liver or renal failure, thyrotoxicosis, Klinefelter syndrome, tumors and environmental pollutants can cause gynecomastia. History and clinical examination will help formulate targeted investigations and management. The factors to be evaluated in these include examination of breasts and testes, in addition to other parts of systemic examination. Treatment of underlying disorders can improve gynecomastia, such as use of testosterone in hypogonadism. Some boys may not need any intervention as gynecomastia may resolve on its own. Medical management is useful in simple gynecomastia. Tamoxifen has been tried successfully in adolescents with gynecomastia. Other drugs including clomiphene, danazol, letrozole and anastrozole have not been consistently useful in this age group. In severe chronic gynecomastia, surgery is the treatment of choice...."
headache after lumbar puncture,"Diagnostic Lumbar Puncture is one of the most commonly performed invasive tests in clinical medicine. Evaluation of an acute headache and investigation of inflammatory or infectious disease of the nervous system are the most common indications. Serious complications are rare, and correct technique will minimise diagnostic error and maximise patient comfort. We review the technique of diagnostic Lumbar Puncture including anatomy, needle selection, needle insertion, measurement of opening pressure, Cerebrospinal Fluid (CSF) specimen handling and after care. We also make some quality improvement suggestions for those designing services incorporating diagnostic Lumbar Puncture...."
hemarthrosis,"Hemophilia A and B are rare X-linked inherited bleeding disorders caused by complete or partial deficiency in or the absence of coagulation factors VIII and IX. Recurrent joint bleeding (hemarthrosis) is the most frequent clinical manifestation of severe hemophilia. Unless appropriately managed, even subclinical hemarthrosis can lead to the development of hemophilic arthropathy, a disabling condition characterized by joint remodelling, chronic pain, and a reduced quality of life, and eventually requires joint replacement. Given the lack of specific treatments to reduce blood-induced synovitis, the prevention of bleeding is pivotal to the maintenance of joint health. Prophylactic coagulation factor replacement therapy using extended half-life recombinant drugs has significantly improved patients' quality of life by reducing the burden of intravenous injections, and the more recent introduction of nonreplacement therapies such as subcutaneous emicizumab injections has improved treatment adherence and led to the greater protection of patients with hemophilia A. However, despite these advances, chronic arthropathy is still a significant problem. The introduction of point-of-care ultrasound imaging has improved the diagnosis of acute hemarthrosis and early hemophilic arthropathy, and allowed the better monitoring of progressive joint damage, but further research into the underlying mechanisms of the disease is required to allow the development of more targeted treatment. In the meantime, patient management should be based on the risk factors for the onset and progression of arthropathy of each individual patient, and all patients should be collaboratively cared for by multidisciplinary teams of hematologists, rheumatologists, orthopedic surgeons, and physiotherapists at comprehensive hemophilia treatment centers...."
hepatorenal syndrome,"Hepatorenal syndrome (HRS), the extreme manifestation of renal impairment in patients with cirrhosis, is characterized by reduction in renal blood flow and glomerular filtration rate. Hepatorenal syndrome is diagnosed when kidney function is reduced but evidence of intrinsic kidney disease, such as hematuria, proteinuria, or abnormal kidney ultrasonography, is absent. Unlike other causes of acute kidney injury (AKI), hepatorenal syndrome results from functional changes in the renal circulation and is potentially reversible with liver transplantation or vasoconstrictor drugs. Two forms of hepatorenal syndrome are recognized depending on the acuity and progression of kidney injury. The first represents an acute impairment of kidney function, HRS-AKI, whereas the second represents a more chronic kidney dysfunction, HRS-CKD (chronic kidney disease). In this review, we provide critical insight into the definition, pathophysiology, diagnosis, and management of hepatorenal syndrome...."
herniated(slipped) disk,"It is wrong to believe that back pain only burdens adults: the yearly incidence during growth ranges from 10-20%, continuously increasing from childhood to adolescence. Rapid growth-related muscular dysbalance and insufficiency, poor physical condition in an increasingly sedentary adolescent community or - vice versa - high level sports activities, account for the most prevalent functional pain syndromes. In contrast to adults the correlation of radiographic findings with pain is high: the younger the patient, the higher the probability to establish a rare morphologic cause such as benign or malignant tumours, congenital malformations and infections. In children younger than 5 years old, the likelihood is more than 50%. The following red flags should lower the threshold for a quick in-depth analysis of the problem: Age of the patient <5 years, acute trauma, functional limitation for daily activities, irradiating pain, loss of weight, duration >4 weeks, history of tumour, exposition to tuberculosis, night pain and fever. High level sport equals a biomechanical field test which reveals the biologic individual response of the growing spine to the sports-related forces. Symptomatic or asymptomatic inhibitory or stimulatory growth disturbances like Scheuermann disease, scoliosis or fatigue fractures represent the most frequent pathomorphologies. They usually occur at the disk-growth plate compound: intraspongious disk herniation, diminuition of anterior growth with vertebral wedging and apophyseal ring fractures often occur when the biomechanical impacts exceed the mechanical resistance of the cartilaginous endplates. Spondylolysis is a benign condition which rarely becomes symptomatic and responds well to conservative measures. Associated slippage of L5 on S1 is frequent but rarely progresses. The pubertal spinal growth spurt is the main risk factor for further slippage, whereas sports activity - even at a high level - is not. Therefore, the athlete should only be precluded from training if pain persists or in case of high grade slips. Perturbance of the sagittal profile with increase of lumbar lordosis, flattening of the thoracic spine and retroflexion of the pelvis with hamstrings contractures are strong signs for a grade IV olisthesis or spondyloptosis with subsequent lumbosacral kyphosis. Idiopathic scoliosis is not related to pain unless it is a marked (thoraco-) lumbar curve or if there is an underlying spinal cord pathology. Chronic back pain is an under recognised entity characterised by its duration (>3 months or recurrence within 3 months) and its social impacts such as isolation and absence from school or work. It represents an independent disease, uncoupled from any initial trigger. Multimodal therapeutic strategies are more successful than isolated, somatising orthopaedic treatment. Primary and secondary preventive active measures for the physically passive adolescents, regular sports medical check-up's for the young high level athletes,..."
hidradenitis suppurativa,"Hidradenitis suppurativa (HS) is an inflammatory disorder that is characterized by chronic deep-seated nodules, abscesses, fistulae, sinus tracts, and scars in the axilla, inguinal area, submammary folds, and perianal area. This disfiguring condition is accompanied by pain, embarrassment, and a significantly decreased quality of life. Although the mechanism of HS has not been entirely elucidated, lesion formation is believed to center around follicular hyperkeratosis within the pilosebaceous-apocrine unit. Recent research has provided new insight into the role of cytokines in the pathogenesis of HS, helping close some existing knowledge gaps in the development of this condition. The first article in this continuing medical education series reviews HS epidemiology, clinical presentation, and classification. We also provide an update on the most recent understanding of HS pathogenesis, including the central role of inflammatory cytokines and other contributing factors, such as genetics, hormones, and pathogenic microorganisms...."
high potassium level,"The global prevalence of chronic kidney disease (CKD) is increasing with the aging of populations worldwide. As kidney function declines, the accumulation of metabolic waste products and excessive electrolytes can significantly impair the health of patients with CKD. As nutritional management of patients with CKD is thought to control uremic symptoms and provide beneficial effects on the progression of kidney dysfunction, the diet of patients with CKD should be an important consideration in their care. Many guidelines recommend limiting protein intake in these patients, as high-protein diets aggravate kidney dysfunction. Excess sodium may be associated with CKD progression and all-cause mortality and, therefore, limiting salt intake is generally recommended. Low potassium is associated with muscle weakness and hypertension, whereas high potassium is associated with cardiac arrhythmia. Therefore, recent guidelines recommend adjusting dietary potassium intake on an individual basis to maintain serum potassium levels within the normal range. Appropriate dietary calcium intake is recommended to maintain calcium balance in patients with CKD G3, G4. Given the many dietary considerations for patients with CKD, effective nutritional management is challenging. Individualized strategies are needed to ensure the best outcome for patients with CKD...."
hives,"This update and revision of the international guideline for urticaria was developed following the methods recommended by Cochrane and the Grading of Recommendations Assessment, Development and Evaluation (GRADE) working group. It is a joint initiative of the Dermatology Section of the European Academy of Allergology and Clinical Immunology (EAACI), the Global Allergy and Asthma European Network (GA²LEN) and its Urticaria and Angioedema Centers of Reference and Excellence (UCAREs and ACAREs), the European Dermatology Forum (EDF; EuroGuiDerm), and the Asia Pacific Association of Allergy, Asthma and Clinical Immunology with the participation of 64 delegates of 50 national and international societies and from 31 countries. The consensus conference was held on 3 December 2020. This guideline was acknowledged and accepted by the European Union of Medical Specialists (UEMS). Urticaria is a frequent, mast cell-driven disease that presents with wheals, angioedema, or both. The lifetime prevalence for acute urticaria is approximately 20%. Chronic spontaneous or inducible urticaria is disabling, impairs quality of life, and affects performance at work and school. This updated version of the international guideline for urticaria covers the definition and classification of urticaria and outlines expert-guided and evidence-based diagnostic and therapeutic approaches for the different subtypes of urticaria...."
human immunodeficiency virus infection (hiv),"This article describes the various non-neoplastic lymphadenopathies that occur in patients infected with the human immunodeficiency virus (HIV), before or during the stage of acquired immunodeficiency syndrome (AIDS). The stages that develop during the HIV infection include: primary infection (acute infection, spread of the virus, development of host immune response, and acute retroviral syndrome), chronic infection or clinical latency, and finally, the AIDS stage. Non-neoplastic lymphadenopathies can occur at any of these phases of the infection and are due to multiple causes that can be divided into infectious causes (bacterial, fungal, parasitic, viral), and reactive causes (persistent generalized lymphadenopathy and a variety of situations that they also occur in immunocompetent people such as Castleman's disease and Kikuchi-Fujimoto's disease, among others). The general, histological and immunophenotypic characteristics of these pathologies are described...."
hydrocephalus,"Hydrocephalus is a serious condition that affects patients of all ages, resulting from a multitude of causes. While the etiologies of hydrocephalus are numerous, many of the acute and chronic symptoms of the condition are shared. These symptoms include disorientation and pain (headaches), cognitive and developmental changes, vision and sleep disturbances, and gait abnormalities. This collective group of symptoms combined with the effectiveness of CSF diversion as a surgical intervention for many types of the condition suggest that the various etiologies may share common cellular and molecular dysfunctions. The incidence rate of pediatric hydrocephalus is approximately 0.1-0.6% of live births, making it as common as Down syndrome in infants. Diagnosis and treatment of various forms of adult hydrocephalus remain understudied and underreported. Surgical interventions to treat hydrocephalus, though lifesaving, have a high incidence of failure. Previously tested pharmacotherapies for the treatment of hydrocephalus have resulted in net zero or negative outcomes for patients potentially due to the lack of understanding of the cellular and molecular mechanisms that contribute to the development of hydrocephalus. Very few well-validated drug targets have been proposed for therapy; most of these have been within the last 5 years. Within the last 50 years, there have been only incremental improvements in surgical treatments for hydrocephalus, and there has been little progress made towards prevention or cure. This demonstrates the need to develop nonsurgical interventions for the treatment of hydrocephalus regardless of etiology. The development of new treatment paradigms relies heavily on investment in researching the common molecular mechanisms that contribute to all of the forms of hydrocephalus, and requires the concerted support of patient advocacy organizations, government- and private-funded research, biotechnology and pharmaceutical companies, the medical device industry, and the vast network of healthcare professionals...."
hyperkalemia,"Hyperkalemia is a common electrolyte disturbance in both inpatient and outpatient clinical practice. The severity and associated risk depends on the underlying cause and rate of potassium (K+) increase. Acute hyperkalemia requires immediate attention due to potentially life-threatening manifestations resulting from the rapid increase in plasma K+ concentration. Treatment is initially focused on stabilizing the cardiac membrane, followed by maneuvers to shift K+ into the cells, and ultimately initiating strategies to decrease total body K+ content. Chronic hyperkalemia develops over a more extended period of time and manifestations tend to be less severe. Nevertheless, the disorder is not benign since chronic hyperkalemia is associated with increased morbidity and mortality. The approach to patients with chronic hyperkalemia begins with a review of medications potentially responsible for the disorder, ensuring effective diuretic therapy and correcting metabolic acidosis if present. The practice of restricting foods high in K+ to manage hyperkalemia is being reassessed since the evidence supporting the effectiveness of this strategy is lacking. Rather, dietary restriction should be more nuanced, focusing on reducing the intake of nonplant sources of K+. Down-titration and/or discontinuation of renin-angiotensin-aldosterone inhibitors should be discouraged since these drugs improve outcomes in patients with heart failure and proteinuric kidney disease. In addition to other conservative measures, K+ binding drugs and sodium-glucose cotransporter 2 inhibitors can assist in maintaining the use of these drugs...."
hypernatremia,"Hypernatremia is an occasionally encountered electrolyte disorder, which may lead to fatal consequences under improper management. Hypernatremia is a disorder of the homeostatic status regarding body water and sodium contents. This imbalance is the basis for the diagnostic approach to hypernatremia. We summarize the eight diagnostic steps of the traditional approach and introduce new biomarkers: exclude pseudohypernatremia, confirm glucose-corrected sodium concentrations, determine the extracellular volume status, measure urine sodium levels, measure urine volume and osmolality, check ongoing urinary electrolyte free water clearance, determine arginine vasopressin/copeptin levels, and assess other electrolyte disorders. Moreover, we suggest six steps to manage hypernatremia by replacing water deficits, ongoing water losses, and insensible water losses: identify underlying causes, distinguish between acute and chronic hypernatremia, determine the amount and rate of water administration, select the type of replacement solution, adjust the treatment schedule, and consider additional therapy for diabetes insipidus. Physicians may apply some of these steps to all patients with hypernatremia, and can also adapt the regimens for specific causes or situations...."
hyperparathyroidism,"We reviewed the etiology and management of secondary and tertiary hyperparathyroidism. Secondary hyperparathyroidism is characterized by an increase in parathyroid hormone (PTH) that is appropriate and in response to a stimulus, most commonly low serum calcium. In secondary hyperparathyroidism, the serum calcium is normal and the PTH level is elevated. Tertiary hyperparathyroidism is characterized by excessive secretion of PTH after longstanding secondary hyperparathyroidism, in which hypercalcemia has ensued. Tertiary hyperparathyroidism typically occurs in men and women with chronic kidney disease usually after kidney transplant. The etiology and treatment of secondary hyperparathyroidism is relatively straightforward whereas data on the management of tertiary hyperparathyroidism is limited to a few small trials with short follow-up...."
hypersensitivity pneumonitis,"The clinical and pathologic diagnosis of hypersensitivity pneumonitis has been confounded by conflicting definitions, with two recent guidelines suggesting that hypersensitivity pneumonitis simply be diagnosed as nonfibrotic or fibrotic. Nonfibrotic hypersensitivity pneumonitis is usually characterized by a bronchiolocentric chronic interstitial inflammatory infiltrate, frequently but by no means always with associated granulomas or giant cells. Fibrotic hypersensitivity pneumonitis may take the form of interstitial fibrosis confined to the peribronchiolar regions, or fibrotic nonspecific interstitial pneumonia, or a process similar to and sometimes indistinguishable from usual interstitial pneumonia/idiopathic interstitial fibrosis, but the exact pathologic features that favor a diagnosis of fibrotic hypersensitivity pneumonitis are disputed. Granulomas/giant cells are much less frequent in fibrotic compared to nonfibrotic hypersensitivity pneumonitis. Extensive peribronchiolar metaplasia, particularly peribronchiolar metaplasia affecting more than half the bronchioles, supports a diagnosis of fibrotic hypersensitivity pneumonitis over usual interstitial pneumonia, as does the presence of predominantly peribronchiolar disease with relative subpleural sparing. Clinical and CT features are crucial to the diagnosis of hypersensitivity pneumonitis: sparing of the lung bases, centrilobular nodules, air-trapping, or the triple density sign with fibrosis favor a diagnosis of fibrotic hypersensitivity pneumonitis. At this point there are no molecular tests that reliably separate fibrotic hypersensitivity pneumonitis from other forms of interstitial lung disease. Currently the separation of fibrotic hypersensitivity pneumonitis from usual interstitial pneumonia is crucial to treatment (immunosuppressives for the former, anti-fibrotics for the latter) but this approach is changing and all progressive fibrosing interstitial pneumonias will probably be treated with antifibrotics in the future...."
hypertensive heart disease,"Hypertension is possibly the most powerful, modifiable risk factor for the development of heart failure. Chronic hypertension drives cardiac remodeling within the left ventricle resulting in hypertensive heart disease, which ultimately manifests as heart failure. Early detection and appropriate management are necessary to prevent heart failure as well as other cardiovascular diseases. Achieving blood pressure goals in conjunction with using evidence-based treatments can improve clinical outcomes for patients with comorbid hypertension and heart failure...."
hypocalcemia,"The aim of this clinical narrative review is to summarize and critically appraise the literature on the differential diagnosis of hypocalcemia and to provide its correct management. Calcium is essential for muscle contraction and neurotransmitter release, but clinical manifestations of hypocalcaemia (serum calcium level <8 mg/dl; 2.12 mmol/L) may involve almost any organ and system and may range from asymptomatic to life-threating conditions. Disorders causing hypocalcemia can be divided into parathyroid hormone (PTH) and non-PTH mediated. The most frequent cause of hypocalcemia is postsurgical hypoparathyroidism, while a more comprehensive search for other causes is needed for appropriate treatment in the non PTH-mediated forms. Intravenous calcium infusion is essential to raise calcium levels and resolve or minimize symptoms in the setting of acute hypocalcemia. Oral calcium and/or vitamin D supplementation is the most frequently used as treatment of chronic hypocalcemia. In hypoparathyroidism, providing the missing hormone with the use of the recombinant human (rh) PTH(1-84) has been recently approved both by the Food and Drug Administration (FDA) and the European Medicines Agency (EMA). This new therapy has the advantage of being effective for correcting serum calcium levels and significantly reducing the daily requirements of calcium and active vitamin D supplements. However, due to the high cost, a strict selection of candidates to this therapy is necessary. More challenging is the long-term hypocalcemia treatment, due to its associated complications. The development of long-acting recombinant human PTH will probably modify the management of chronic hypoparathyroidism in the future...."
